{
  "version": "v1",
  "domain": "sleep",
  "user_id": "user-123",
  "received_at": "2025-09-27T12:34:56Z",
  "source": {
    "provider": "oura",
    "event_id": "evt-3",
    "delivery_id": "del-3"
  },
  "session_id": "sleep-2025-09-26",
  "start_time": "2025-09-26T23:05:00Z",
  "end_time": "2025-09-27T06:55:00Z",
  "metrics": {
    "total_duration_sec": 27900,
    "efficiency_pct": 92,
    "latency_sec": 600,
    "awakenings": 2,
    "score": 85
  },
  "stages": [
    { "stage": "light", "start_time": "2025-09-26T23:15:00Z", "end_time": "2025-09-26T23:45:00Z", "duration_sec": 1800 },
    { "stage": "deep",  "start_time": "2025-09-26T23:45:00Z", "end_time": "2025-09-27T00:30:00Z", "duration_sec": 2700 },
    { "stage": "rem",   "start_time": "2025-09-27T05:30:00Z", "end_time": "2025-09-27T06:10:00Z", "duration_sec": 2400 }
  ]
}
